{
  "schema_version": "1.0.0",
  "verdict": "TRUE_POSITIVE",
  "confidence": "HIGH",
  "severity": "HIGH",
  "overall_risk": "MEDIUM",
  "source_type": "cef",
  "summary": "Trend Micro Deep Security anti-malware detected the file invoice_scan.exe written to C:\\Users\\example.user\\Downloads on WKS-EXAMPLE-42 and quarantined it. The detection name reported was TROJ_EXAMPLE.SM and the recorded action was Quarantine with result Success.",
  "evidence": [
    {
      "field": "Timestamp",
      "value": "2026-08-03T10:02:44Z"
    },
    {
      "field": "Product",
      "value": "Trend Micro Deep Security"
    },
    {
      "field": "Module",
      "value": "Anti-Malware"
    },
    {
      "field": "Host",
      "value": "WKS-EXAMPLE-42"
    },
    {
      "field": "User",
      "value": "CORP\\example.user"
    },
    {
      "field": "File Path",
      "value": "C:\\Users\\example.user\\Downloads\\invoice_scan.exe"
    },
    {
      "field": "File Hash (SHA-256)",
      "value": "3b1f8c2d4e5a6079b8c1d2e3f405162738495a6b7c8d9e0f1a2b3c4d5e6f7081"
    },
    {
      "field": "Detection",
      "value": "TROJ_EXAMPLE.SM"
    },
    {
      "field": "Action",
      "value": "Quarantine"
    },
    {
      "field": "Result",
      "value": "Success"
    }
  ],
  "assessment": "The supplied event demonstrates that a file identified by Deep Security as malware was present on the endpoint and was successfully quarantined. The detection itself, the file path and the successful quarantine result are directly observable, which supports a true positive verdict with high confidence in the detection. Overall risk is assessed as medium rather than high because the supplied evidence shows the file was quarantined and contains no indication that it executed, established persistence, or initiated network activity. The supplied evidence does not establish how the file reached the endpoint, whether the user attempted to run it, or whether other hosts received the same file. Severity is high because malware reaching a user endpoint is a material control failure regardless of the outcome, and severity is assessed independently of the quarantine result.",
  "recommended_actions": [
    "Review endpoint telemetry on WKS-EXAMPLE-42 for process creation involving invoice_scan.exe to confirm whether execution was attempted before quarantine.",
    "Review proxy and mail gateway logs to determine the delivery vector for the file.",
    "Search the environment for the recorded SHA-256 hash to identify other affected hosts.",
    "Review authentication and network activity for CORP\\example.user around the detection timestamp.",
    "Confirm the quarantine remains in place and the file was not restored."
  ],
  "missing_information": [
    "Delivery vector (email, web download, removable media)",
    "Whether process execution was attempted prior to quarantine",
    "Presence of the same hash on other endpoints",
    "Network connections from the host around the detection time",
    "Whether the user reported an associated phishing message"
  ],
  "mitre_attack": [
    {
      "technique_id": "T1204.002",
      "technique_name": "User Execution: Malicious File",
      "tactic": "Execution",
      "supporting_evidence": "A malicious executable was written to the user's Downloads directory under the user's own profile path, consistent with user-initiated retrieval. Note that no execution is observed in this event; the mapping describes the delivery pattern only and does not assert that the file ran."
    }
  ],
  "analyst_review_required": true,
  "automated_action_taken": false
}
